{
	"$schema": "http://json-schema.org/draft-07/schema#",
	"$id": "https://solstice.local/schema/world.schema.json",
	"title": "Solstice world preset contract",
	"description": "Realm generation parameters. Truth: docs/setting/WORLD.md SS2.1 (scale), SS2.2 (biome thresholds), SS3.3 (creation flow). Read at runtime from game/Config/Solstice/Data/world.json. One tile is one metre.",
	"type": "object",
	"required": ["default"],
	"properties": {
		"_comment": { "type": "string" },
		"_note": { "type": "string" },
		"default": { "$ref": "#/definitions/world" },
		"presets": {
			"type": "array",
			"items": { "$ref": "#/definitions/world" }
		}
	},
	"definitions": {
		"biText": {
			"type": "object",
			"properties": {
				"zh": { "type": "string" },
				"en": { "type": "string" }
			},
			"additionalProperties": false
		},
		"world": {
			"type": "object",
			"required": ["size", "algo", "seed"],
			"properties": {
				"realm_id": { "type": "string", "description": "Stable identity of the realm, e.g. realm.valley." },
				"realm_name": { "$ref": "#/definitions/biText" },
				"size": {
					"type": "integer",
					"minimum": 32,
					"maximum": 512,
					"description": "Tiles per axis. The M0 small realm is 128 (docs/setting/WORLD.md SS2.1)."
				},
				"chunk_size": {
					"type": "integer",
					"minimum": 16,
					"description": "Tiles per chunk side; drives the dirty-region rebuild granularity."
				},
				"algo": {
					"type": "string",
					"enum": ["ridges", "islands", "canyon", "plateau", "basin", "archipelago"],
					"description": "Terrain algorithm. Six ship in M0 so the creator's reshape step has something to choose from."
				},
				"seed": { "type": "integer", "minimum": 0, "description": "Deterministic generation seed." },
				"base_water_level": { "type": "number", "minimum": 0, "maximum": 32 },
				"latitude": {
					"type": "number",
					"minimum": -90,
					"maximum": 90,
					"description": "Drives the solar path and the season when the reality anchor is offline."
				},
				"tidal_amplitude": { "type": "number", "minimum": 0 },
				"tides": { "type": "boolean", "default": false },
				"chaos_start": {
					"type": "boolean",
					"default": true,
					"description": "The realm begins as uncoloured paper with no life (docs/setting/WORLD.md SS3.3 step 5)."
				},
				"life_seed": {
					"type": "boolean",
					"default": false,
					"description": "Creator step 8. True seeds the species that the biomes can support."
				}
			},
			"additionalProperties": false
		}
	}
}
