{
	"_comment": "Solstice M0 world generation presets. Truth: docs/setting/WORLD.md SS2.1 (scale), SS2.2 (biome thresholds), SS3.3 (generation flow). Contract: shared/schema/world.schema.json.",
	"_note": "size / chunk_size are in tiles; 1 tile = 1 m. algo picks the terrain algorithm in SolsticeKernel::GenerateTerrain. Six algorithms ship in M0 so the 'global reshape' card and the creator's形制 step have something to choose from.",
	"default": {
		"realm_id": "realm.valley",
		"realm_name": { "zh": "无名之界", "en": "Nameless Realm" },
		"size": 128,
		"chunk_size": 64,
		"algo": "ridges",
		"seed": 20261016,
		"base_water_level": 6.0,
		"latitude": 31.23,
		"tidal_amplitude": 1.0,
		"tides": false,
		"chaos_start": true,
		"life_seed": false
	},
	"presets": [
		{
			"realm_id": "realm.ridges",
			"realm_name": { "zh": "褶皱原", "en": "The Ridged Plain" },
			"size": 128,
			"chunk_size": 64,
			"algo": "ridges",
			"seed": 11011,
			"base_water_level": 6.0,
			"latitude": 31.23,
			"tidal_amplitude": 1.0,
			"tides": false,
			"chaos_start": true,
			"life_seed": false
		},
		{
			"realm_id": "realm.isles",
			"realm_name": { "zh": "散岛", "en": "Scattered Isles" },
			"size": 128,
			"chunk_size": 64,
			"algo": "islands",
			"seed": 22022,
			"base_water_level": 8.0,
			"latitude": 22.54,
			"tidal_amplitude": 1.4,
			"tides": true,
			"chaos_start": true,
			"life_seed": false
		},
		{
			"realm_id": "realm.canyon",
			"realm_name": { "zh": "深缝", "en": "The Deep Seam" },
			"size": 128,
			"chunk_size": 64,
			"algo": "canyon",
			"seed": 33033,
			"base_water_level": 4.0,
			"latitude": 39.9,
			"tidal_amplitude": 0.6,
			"tides": false,
			"chaos_start": true,
			"life_seed": false
		},
		{
			"realm_id": "realm.plateau",
			"realm_name": { "zh": "层台", "en": "Stacked Plateau" },
			"size": 128,
			"chunk_size": 64,
			"algo": "plateau",
			"seed": 44044,
			"base_water_level": 5.0,
			"latitude": 30.57,
			"tidal_amplitude": 0.8,
			"tides": false,
			"chaos_start": true,
			"life_seed": false
		},
		{
			"realm_id": "realm.basin",
			"realm_name": { "zh": "浅盆", "en": "Shallow Basin" },
			"size": 128,
			"chunk_size": 64,
			"algo": "basin",
			"seed": 55055,
			"base_water_level": 7.0,
			"latitude": 34.34,
			"tidal_amplitude": 0.9,
			"tides": false,
			"chaos_start": true,
			"life_seed": false
		},
		{
			"realm_id": "realm.archipelago",
			"realm_name": { "zh": "碎礁", "en": "Broken Reef" },
			"size": 128,
			"chunk_size": 64,
			"algo": "archipelago",
			"seed": 66066,
			"base_water_level": 9.0,
			"latitude": 31.23,
			"tidal_amplitude": 1.8,
			"tides": true,
			"chaos_start": true,
			"life_seed": false
		}
	]
}
